{
  "$schema": "https://json-schema.org/draft/2020-12/schema",
  "type": "object",
  "properties": {
    "specVersion": {
      "type": "integer",
      "minimum": -9007199254740991,
      "maximum": 9007199254740991
    },
    "id": {
      "type": "string"
    },
    "title": {
      "type": "string"
    },
    "description": {
      "type": "string"
    },
    "parameters": {
      "type": "array",
      "items": {
        "oneOf": [
          {
            "type": "object",
            "properties": {
              "kind": {
                "type": "string",
                "const": "int"
              },
              "id": {
                "type": "string"
              },
              "title": {
                "type": "string"
              },
              "help": {
                "type": "string"
              },
              "section": {
                "type": "string"
              },
              "order": {
                "type": "number"
              },
              "widget": {
                "type": "string"
              },
              "required": {
                "type": "boolean"
              },
              "min": {
                "type": "integer",
                "minimum": -9007199254740991,
                "maximum": 9007199254740991
              },
              "max": {
                "type": "integer",
                "minimum": -9007199254740991,
                "maximum": 9007199254740991
              },
              "step": {
                "type": "integer",
                "minimum": -9007199254740991,
                "maximum": 9007199254740991
              },
              "default": {
                "type": "integer",
                "minimum": -9007199254740991,
                "maximum": 9007199254740991
              }
            },
            "required": [
              "kind",
              "id"
            ],
            "additionalProperties": false
          },
          {
            "type": "object",
            "properties": {
              "kind": {
                "type": "string",
                "const": "float"
              },
              "id": {
                "type": "string"
              },
              "title": {
                "type": "string"
              },
              "help": {
                "type": "string"
              },
              "section": {
                "type": "string"
              },
              "order": {
                "type": "number"
              },
              "widget": {
                "type": "string"
              },
              "required": {
                "type": "boolean"
              },
              "min": {
                "type": "number"
              },
              "max": {
                "type": "number"
              },
              "step": {
                "type": "number"
              },
              "default": {
                "type": "number"
              }
            },
            "required": [
              "kind",
              "id"
            ],
            "additionalProperties": false
          },
          {
            "type": "object",
            "properties": {
              "kind": {
                "type": "string",
                "const": "string"
              },
              "id": {
                "type": "string"
              },
              "title": {
                "type": "string"
              },
              "help": {
                "type": "string"
              },
              "section": {
                "type": "string"
              },
              "order": {
                "type": "number"
              },
              "widget": {
                "type": "string"
              },
              "required": {
                "type": "boolean"
              },
              "default": {
                "type": "string"
              }
            },
            "required": [
              "kind",
              "id"
            ],
            "additionalProperties": false
          },
          {
            "type": "object",
            "properties": {
              "kind": {
                "type": "string",
                "const": "bool"
              },
              "id": {
                "type": "string"
              },
              "title": {
                "type": "string"
              },
              "help": {
                "type": "string"
              },
              "section": {
                "type": "string"
              },
              "order": {
                "type": "number"
              },
              "widget": {
                "type": "string"
              },
              "required": {
                "type": "boolean"
              },
              "default": {
                "type": "boolean"
              }
            },
            "required": [
              "kind",
              "id"
            ],
            "additionalProperties": false
          },
          {
            "type": "object",
            "properties": {
              "kind": {
                "type": "string",
                "const": "enum"
              },
              "id": {
                "type": "string"
              },
              "title": {
                "type": "string"
              },
              "help": {
                "type": "string"
              },
              "section": {
                "type": "string"
              },
              "order": {
                "type": "number"
              },
              "widget": {
                "type": "string"
              },
              "required": {
                "type": "boolean"
              },
              "options": {
                "minItems": 1,
                "type": "array",
                "items": {
                  "type": "string"
                }
              },
              "default": {
                "type": "string"
              }
            },
            "required": [
              "kind",
              "id",
              "options"
            ],
            "additionalProperties": false
          },
          {
            "type": "object",
            "properties": {
              "kind": {
                "type": "string",
                "const": "sourceRef"
              },
              "id": {
                "type": "string"
              },
              "title": {
                "type": "string"
              },
              "help": {
                "type": "string"
              },
              "section": {
                "type": "string"
              },
              "order": {
                "type": "number"
              },
              "widget": {
                "type": "string"
              },
              "required": {
                "type": "boolean"
              },
              "accepts": {
                "minItems": 1,
                "type": "array",
                "items": {
                  "type": "string"
                }
              }
            },
            "required": [
              "kind",
              "id",
              "accepts"
            ],
            "additionalProperties": false
          },
          {
            "type": "object",
            "properties": {
              "kind": {
                "type": "string",
                "const": "bounds"
              },
              "id": {
                "type": "string"
              },
              "title": {
                "type": "string"
              },
              "help": {
                "type": "string"
              },
              "section": {
                "type": "string"
              },
              "order": {
                "type": "number"
              },
              "widget": {
                "type": "string"
              },
              "required": {
                "type": "boolean"
              },
              "default": {
                "type": "array",
                "prefixItems": [
                  {
                    "type": "number"
                  },
                  {
                    "type": "number"
                  },
                  {
                    "type": "number"
                  },
                  {
                    "type": "number"
                  },
                  {
                    "type": "number"
                  },
                  {
                    "type": "number"
                  }
                ]
              }
            },
            "required": [
              "kind",
              "id"
            ],
            "additionalProperties": false
          }
        ]
      }
    },
    "outputs": {
      "type": "array",
      "items": {
        "type": "object",
        "properties": {
          "id": {
            "type": "string"
          },
          "title": {
            "type": "string"
          },
          "help": {
            "type": "string"
          },
          "type": {
            "type": "string"
          },
          "format": {
            "type": "string"
          }
        },
        "required": [
          "id"
        ],
        "additionalProperties": false
      }
    }
  },
  "required": [
    "specVersion",
    "id",
    "title",
    "parameters",
    "outputs"
  ],
  "additionalProperties": false
}
